Company,Title,Location,Posted Date,Ethics,Visa?,Apply URL,Notes
Zurich Insurance,Senior Pricing Data Scientist,"Barcelona, ES",2026-03-03,neutral,Likely (company sponsors),https://www.careers.zurich.com/job/Barcelona-Senior-Pricing-Data-Scientist/1354332357/,ServiZurich tech hub in Barcelona. J2W/SAP SuccessFactors RSS feed.
Mango,BECARIO/A DATA SCIENTIST,"PALAU SOLITÀ I PLEGAMANS, Barcelona",2026-03-04,neutral,Unknown,https://mango.wd3.myworkdayjobs.com/en-US/Mango_Work_Your_Passion/job/Palau-solit-i-Plegamans-Catalonia-Spain/BECARIO-A-DATA-SCIENTIST_JR131249,Fashion retailer HQ in Barcelona
N26,Product Manager - AI Products,Barcelona,2026-03-03,neutral,Yes (job posting),https://n26.com/en-eu/careers/positions/7673342?gh_jid=7673342,"Barcelona tech hub, digital bank."
N26,Product Manager - AI Products,Berlin,2026-03-03,neutral,Yes (job posting),https://n26.com/en-eu/careers/positions/7668144?gh_jid=7668144,"Barcelona tech hub, digital bank."
TravelPerk (Perk),"Lead, Analytics Engineer",Barcelona,2026-03-03,neutral,Yes (job posting),https://jobs.ashbyhq.com/perk/88f86446-3091-47fd-98f2-7ebe078abd9a,"Strong data team, Series D funded"
TravelPerk (Perk),Data Analyst ,Barcelona,2026-03-03,neutral,Yes (job posting),https://jobs.ashbyhq.com/perk/6c1acfe8-a6c4-4a5d-bfd6-e219fdcb59d7,"Strong data team, Series D funded"
Clarivate,"Data Science Consultant, Discovery & Translational Science",Spain - Barcelona,2026-03-03,neutral,Likely (company sponsors),https://clarivate.wd3.myworkdayjobs.com/en-US/Clarivate_Careers/job/Spain---Barcelona/Data-Science-Consultant--Discovery---Translational-Science_JREQ134732-1,"Web of Science, Derwent. Phenom People frontend, Workday backend (wd3). Location in locationsText field."
Zurich Insurance,AI Prototyping Internship,"Barcelona, ES",2026-03-03,neutral,Likely (company sponsors),https://www.careers.zurich.com/job/Barcelona-AI-Prototyping-Internship/1351745057/,ServiZurich tech hub in Barcelona. J2W/SAP SuccessFactors RSS feed.
Mango,AI ENGINEER,"PALAU SOLITÀ I PLEGAMANS, Barcelona",2026-03-03,neutral,Unknown,https://mango.wd3.myworkdayjobs.com/en-US/Mango_Work_Your_Passion/job/Palau-solit-i-Plegamans-Catalonia-Spain/AI-ENGINEER_JR131137,Fashion retailer HQ in Barcelona
