Company,Title,Location,Posted Date,Ethics,Visa?,Apply URL,Notes
Docplanner,Product Data Engineer,"Bologna, it",2026-03-20,good,Likely (company sponsors),https://jobs.smartrecruiters.com/Docplanner/744000115899047,Operates in multiple countries
Docplanner,Product Data Engineer,"Barcelona, es",2026-03-20,good,Likely (company sponsors),https://jobs.smartrecruiters.com/Docplanner/744000115898292,Operates in multiple countries
Docplanner,Senior Data Analyst,"Madrid, es",2026-03-20,good,Likely (company sponsors),https://jobs.smartrecruiters.com/Docplanner/744000115938287,Operates in multiple countries
Wallapop,Senior Quantitative Researcher,Barcelona,2026-03-20,good,Yes (job posting),https://job-boards.eu.greenhouse.io/wallapop/jobs/4689105101,Strong ML focus for recommendations
Zurich Insurance,Data Analyst / Data Engineer (Commercial Insurance),"Barcelona, ES",2026-03-20,neutral,Likely (company sponsors),https://www.careers.zurich.com/job/Barcelona-Data-Analyst-Data-Engineer-%28Commercial-Insurance%29/1355937657/,ServiZurich tech hub in Barcelona. J2W/SAP SuccessFactors RSS feed.
Microsoft,Senior Applied Scientist,"Senior Applied Scientist



Spain, Barcelona, Barcelona",2026-03-20,neutral,Likely (company sponsors),https://microsoft.eightfold.ai/careerhub/explore/jobs/1970393556834499,"Multinational infrastructure, established visa sponsorship. Barcelona office. Jobs scraped via email alerts."
