Company,Title,Location,Posted Date,Ethics,Visa?,Apply URL,Notes
Mango,Agentic AI Engineer,"PALAU SOLITÀ I PLEGAMANS, Barcelona",2026-06-01,neutral,Unknown,https://mango.wd3.myworkdayjobs.com/en-US/Mango_Work_Your_Passion/job/Palau-solit-i-Plegamans-Catalonia-Spain/NodeJS-Software-Engineer---Conversational-AI_JR126586,Fashion retailer HQ in Barcelona
Mango,STAGER DATA SCIENCE,"PALAU SOLITÀ I PLEGAMANS, Barcelona",2026-06-01,neutral,Unknown,https://mango.wd3.myworkdayjobs.com/en-US/Mango_Work_Your_Passion/job/Palau-solit-i-Plegamans-Catalonia-Spain/STAGER-DATA-SCIENCE_JR135089,Fashion retailer HQ in Barcelona
N26,Marketing Analytics Engineer,Berlin,2026-06-01,neutral,Yes (job posting),https://n26.com/en-eu/careers/positions/7962721?gh_jid=7962721,"Barcelona tech hub, digital bank."
N26,Marketing Analytics Engineer,Barcelona,2026-06-01,neutral,Yes (job posting),https://n26.com/en-eu/careers/positions/7962618?gh_jid=7962618,"Barcelona tech hub, digital bank."
Fever,Research Data Analyst,Madrid,2026-06-01,neutral,Unknown,https://job-boards.eu.greenhouse.io/feverup/jobs/4121570101,"Large events platform, Barcelona office"
