Company,Title,Location,Posted Date,Ethics,Visa?,Apply URL,Notes
Amazon,"Machine Learning Scientist / Applied Scientist, EU Prime and Marketing Analytics & Science (PRIMAS)","Barcelona, Catalonia, ESP",2025-12-22,kinda_evil,Likely (company sponsors),https://www.amazon.jobs/en/jobs/3147267/machine-learning-scientist-applied-scientist-eu-prime-and-marketing-analytics-science-primas,"Massive DS hiring, established visa process. Barcelona office includes AWS and retail teams."
Amazon,"Data Scientist / Business Intel Engineer, EU Prime and Marketing Analytics & Science (PRIMAS)","Barcelona, Catalonia, ESP",2026-01-29,kinda_evil,Likely (company sponsors),https://www.amazon.jobs/en/jobs/3169456/data-scientist-business-intel-engineer-eu-prime-and-marketing-analytics-science-primas,"Massive DS hiring, established visa process. Barcelona office includes AWS and retail teams."
Preply,Senior Engineering Manager ,Barcelona,2026-02-06,good,Yes (job posting),https://jobs.ashbyhq.com/preply/1eef47ae-6edc-44a0-bb9f-0b6ad217a2fc,Online tutoring marketplace
TravelPerk (Perk),Director of Finance Transformations,Barcelona,2026-02-06,neutral,Yes (job posting),https://jobs.ashbyhq.com/perk/650096dc-8809-44fa-a9f0-810adae7ec76,"Strong data team, Series D funded"
Glovo,Data Analyst II - Compensations Policy Optimization (They/She/He),"Barcelona, Spain (Hybrid)",2026-02-05,neutral,Likely (company sponsors),https://jobs.glovoapp.com/find-your-ride/job/:slug/8395639002/?gh_jid=8395639002,"Fast-growing, strong eng culture"
