Company,Title,Location,Posted Date,Ethics,Visa?,Apply URL,Notes
N26,Senior Marketing Analytics Engineer,Barcelona,2026-02-11,neutral,Yes (job posting),https://n26.com/en-eu/careers/positions/7270383?gh_jid=7270383,"Barcelona tech hub, digital bank."
Fever,Senior Project Manager / Data Team,Madrid,2026-02-11,neutral,Unknown,https://job-boards.eu.greenhouse.io/feverup/jobs/4779998101,"Large events platform, Barcelona office"
Docplanner,Senior Product Analyst (100% remote-friendly within Spain),"Barcelona, es",2026-02-11,good,Likely (company sponsors),https://jobs.smartrecruiters.com/Docplanner/744000108804989,Operates in multiple countries
N26,Senior Data Analyst - Grow & Engage,Barcelona,2026-02-10,neutral,Yes (job posting),https://n26.com/en-eu/careers/positions/7525673?gh_jid=7525673,"Barcelona tech hub, digital bank."
Fever,Senior Data Collection Engineer,Argentina,2026-02-10,neutral,Unknown,https://job-boards.eu.greenhouse.io/feverup/jobs/4778248101,"Large events platform, Barcelona office"
Preply,Director of Data Products - Barcelona,Barcelona,2026-02-10,good,Yes (job posting),https://jobs.ashbyhq.com/preply/f195e96e-2493-4232-8ee6-3e73ab8b8ad8,Online tutoring marketplace
Preply,Staff Data Engineer - Data Ingestion and Enrichment team,Barcelona,2026-02-10,good,Yes (job posting),https://jobs.ashbyhq.com/preply/5e3bf42f-bb5f-4da7-a257-39218b7ff977,Online tutoring marketplace
Docplanner,Senior Product Designer (100% remote-friendly within Spain),"Barcelona, es",2026-02-11,good,Likely (company sponsors),https://jobs.smartrecruiters.com/Docplanner/744000108716685,Operates in multiple countries
